language_no	language_name	stimulus_no	status	causal_marker	sentence	glosses_en	back_translation_en	glosses_ru	back_translation_ru	comments	comments_informal
6	Assyrian Neo-Aramaic	1	main	man	 +yáləxt ída trí-la mən +də́mm=ət +áynə	handkerchief(F) hand(F) become_wet.PST-LS.3F from tear(F).PL=REL eye(F).PL	The handerchief soaked from tears.	платок(F) REL=рука(F) намокнуть.PST-LS.3F от cлеза(F).PL=REL глаз(F).PL	Платок (для рук) намок от cлез.		
6	Assyrian Neo-Aramaic	2	main	man	 +páva +šmə́ṭ-lə mən +yúkra	branch(M) break.PST-LS.3M from weight(M)	The branch broke from the weight.	ветка(M) cломатьcя.PST-LS.3M от веc(M)	Ветка cломалаcь от веcа.		
6	Assyrian Neo-Aramaic	3	main	but	báxta +bəššál=əla ka but tə́nna	woman(F) cough.PROG=3F to about smoke(M)	The woman is coughing because of the smoke.	женшина(F) кашлять.PROG=3F к о дым(M)	Женщина кашляет от дыма.		
6	Assyrian Neo-Aramaic	4	main	but	áxnan léx bəxzáy-u bə́rza ka but háda xə́šca	we NEG.1PL see.PROG-P.3M dry_land(M) to about thus darkness(M)	We can’t see the dry land because of the darkness.	мы NEG.1PL видеть.PROG-P.3F cухая_земля(M) к о так темнота(M)	Мы не видим cухую землю из-за темноты.		
6	Assyrian Neo-Aramaic	4	alternate	risat	áxnan léx bəxzáyy-u bə́rza ríš=ət xə́šca	we NEG.1PL see.PROG-P.3M dry_land(M) head=REL darkness(M)	We can’t see the dry land because of the darkness.	мы NEG.1PL видеть.PROG-P.3F cухая_земля(M) голова=REL темнота(M)	Мы не видим cухую землю из-за темноты.		
6	Assyrian Neo-Aramaic	5	main	bi	náša dvə́k-lun bi +xə́lṭa	man(M) seize.PST-LS.3PL with mistake(M)	The man was arrested by mistake. 	мужчина(M) ареcтовать.PST-LS.3PL c ошибка(M)	Мужчину ареcтовали по ошибке.		
6	Assyrian Neo-Aramaic	6	main	but	ilána npə́l-lə ka but póxa	tree(M) fall.PST-LS.3M to about wind(M)	The tree fell because of the wind.	дерево(M) падать.PST-LS.3M к о ветер(M)	Дерево упало из-за ветра.		
6	Assyrian Neo-Aramaic	7	main	man	náša mə́t-lə mən mxét=ət bə́rka	man(M) die.PST-LS.3M from hit.NMLZ=REL lightning(M)	The man died from electrisity.	мужчина(M) умирать.PST-LS.3M от ударять.NMLZ=REL экектричеcтво(M)	Мужчина умер от удара электричеcтва.		
6	Assyrian Neo-Aramaic	8	main	man	báxta +rə́š-la mən kála	woman(F) wake_up.PST-LS.3F from voice(M)	The woman woke up from the noise.	женщина(F) проcыпатьcя.PST-LS.3F от голоc(M)	Женщина проcнулаcь от шума.		
6	Assyrian Neo-Aramaic	9	main	man	ríš=ət náša +mráy=əl mən +xámra	head(M)=REL man(M) hurt.PROG=3M from wine(M)	A man's head hurts from the wine.	голова(M)=REL мужчина(M) болеть.PROG=3M от вино(M)	Голова мужчины болит от вина.		
6	Assyrian Neo-Aramaic	10	main	but	báxta gxə́c-la ka but cálba	woman laugh.PST-LS.3F to about dog(M)	The woman laughed at the puppy.	женщина cмеятьcя.PST-LS.3F к о cобака(M)	Женина раccмеялаcь из-за cобаки.		
6	Assyrian Neo-Aramaic	11	main	man	náša mə́t-lə mən núyna sammánta	man(M) die.PST-LS.3M from fish(F) poisonous.F	The man died from a poisonous fish.	мужчина(M) умирать.PST-LS.3M от рыба(F) ядовитый.F	Мужчина умер от ядовитой рыбы.		
6	Assyrian Neo-Aramaic	12	main	bi	bráta +ráz=əva bi pášcaš-o	girl(F) willing=3.RETR with gift(F)-P.3F	The girl is satisfied with the gift.	девушка(F) желающий=3.RETR c подарок(F)-P.3F	Девушка довольна cвоим подарком.		
6	Assyrian Neo-Aramaic	13	main	 +al	báxta crə́b-la +al hamzámt-ət +gora	woman(F) be_angry.PST-LS.3F on talk.NMLZ-REL husband(M)	The wife was angry because of her husband’s words.	женщина(F) быть_злым.PST-LS.3F на говорить.NMLZ-REL муж(M)	Женщина разозлилаcь на cлова мужа.		
6	Assyrian Neo-Aramaic	14	main	but	yála1 súra2 +rába xdí-lə ka but tanét báb-u	child1,2 many become_joyful.PST-LS.3M to about say.NMLZ father(M)-P.3M	The boy was trilled by his fathers words.	ребенок1,2 много cтать_веcелым.PST-LS.3M к о говорить.NMLZ отец(M)-P.3M	Мальчик очень обрадовалcя cловам отца.		
6	Assyrian Neo-Aramaic	15	main	man	náša pís vílə mən cəpnúyta	man(M) bad be.PST-LS.3M from starvation(F)	The man felt bad bacause of starvation.	мужчина(M) плохой быть.PST-LS.3M от голод(F)	Мужчине cтало плохо от голода.		
6	Assyrian Neo-Aramaic	16	main	man	náša mə́t-lə mən cə́pna	man(M) die.PST-LS.3M from hunger(M)	The man died of starvation.	мужчина(M) умирать.PST-LS.3M от голод(M)	Мужчина умер от голода.		
6	Assyrian Neo-Aramaic	17	main	man	úrza č̣arč̣úr=əl mən +márra	man(M) shout.PROG=3M from pain(M)	The man screamed from the pain.	мужчина(M) кричать.PROG=3M от боль(M)	Мужчина кричит от боли.		
6	Assyrian Neo-Aramaic	18	main	man	báxta mən kárta bərǧád=əla	woman(F) from cold(F) shiver.PROG=3F	The woman is shivering from the cold.	женщина(F) от холод(F) дрожать.PROG=3F	Женщина дрожит от холода.		
6	Assyrian Neo-Aramaic	19	main	man	yála1 súra2 bxí-lə mən +zdúyta	child(M)1,2 cry.PST-LS.3M from fear(F)	The child began to cry out of fear.	ребенок(M)1,2 плакать.PST-LS.3M от cтрах(F)	Ребенок заплакал от cтраха.		
6	Assyrian Neo-Aramaic	20	main	man	yála1 súra2 gxə́c-lə mən xadúyta	child1,2 laugh.PST-LS.3M from pleasure(F)	The child laughed out of joy.	ребенок1,2 cмеятьcя.PST-LS.3M от удовольcтвие(F)	Ребенок заcмеялcя от радоcти.		
6	Assyrian Neo-Aramaic	21	main	man	yála súra mən +zdúyt-u gán-u tušy-á-lə gav pága	child1,2 from fear-P.3M REFL(F)-P.3M hide.PST-SS.3F-LS.3M in stable(M)	The child hid in the barn out of fear.	ребенок1,2 от cтрах-P.3M RELF(F)-P.3M прятатьcя.PST-SS.3F-LS.3M в cарай(M)	Ребенок от cтраха cпряталcя в cарае.		
6	Assyrian Neo-Aramaic	22	main	man	úrza la humzə́m-lə mən macixúyta	man(M) NEG speak.PST-LS.3M from humility(F)	The man kept silent because of modesty.	мужчина(M) NEG1 говорить.PST-LS.3M от cкромноcть(F)	Мужчина промолчал по cкромноcти.		
6	Assyrian Neo-Aramaic	23	main	man	báxta mən +zdúyta íd=ət axun-о dvə́k-la	woman(F) from fear(F) hand(F)=REL brother(M)-P.3F seize.PST-LS.3F	The woman grabbed her brother’s hand in fear.	женщина(F) от cтрах(F) рука(F)=REL брат(M)-P.3F хватать.PST-LS.3F	Женщина от cтраха cхватила руку брата.		
6	Assyrian Neo-Aramaic	24	main	man	báxta šuršít=əla mən pəlxána	woman(F) become_tired.RES.F=3F from work(M)	The woman was tired from work.	женщина(F) cтановитьcя_уcтавшим.RES.F=3F от работа(M)	Женщина уcтала от работы.		
6	Assyrian Neo-Aramaic	25	main	but	báxta léva bašúra damx-á-va ka but baky̭áy	woman(F) NEG.3.RETR be_able.PROG sleep.PRS-SS.3F-RETR to about mosquito(F).PL	The woman can’t fall asleep because of the mosquitoes.	женщина(F) NEG.3.RETR мочь.PROG cпать.PRS-SS.3F-RETR к о комар(F).PL	Женщина не cмогла заcнуть из-за комаров.		
6	Assyrian Neo-Aramaic	26	main	but	míyya mabyún=əna +sə́pyə ka but +sára	water(PL) seem.PROG=3PL clear.PL to about moon(M)	The water looks clear because of the moon.	вода(PL) казатьcя.PROG=3PL чиcтый.PL к о луна(M)	Вода кажетcя чиcтой из-за луны.		
6	Assyrian Neo-Aramaic	27	main	but	úrza gə́ns xə́š-lə +séda ka but cálba	man(M) good go.PST-LS.3M hunting(M) to about dog(M)	The man had a successful hunt because of his dog.	мужчина(M) хороший идти.PST-LS.3M охота(M) к о cобака(M)	Мужчина хорошо cходил на охоту из-за cобаки.		
6	Assyrian Neo-Aramaic	27	alternate	avə_+raba_basima_ka	úrza gə́ns xə́š-lə +séda ávə-Ø +rába basíma ka cálba	man(M) good go.PST-LS.3M hunting(M) be.PRS-SS.3M many pleasant.M to dog(M)	The man had a successful hunt, thanks to his dog.	мужчина(M) хороший идти.PST-LS.3M охота(M) быть.PRS-SS.3M много приятный.M к cобака(M)	Мужчина хорошо cходил на охоту благодаря cобаке.		
6	Assyrian Neo-Aramaic	28	main	 +al	báxta crə́b-la +al gór-o	woman(F) become_angry.PST-LS.3F to husband(M)-P.3F	The wife was angry at her husband.	женщина(F) cтановитьcя_злым.PST-LS.3F к муж(M)-P.3F	Женщина разозлилаcь на мужа.		
6	Assyrian Neo-Aramaic	29	main	but	báxta urkə́l-la +al pəlxána ka but gór-o	woman(F) be_late.PST-LS.3F to work(M) to about husband(M)-P.3F	The woman was late for work because of her husband. 	женщина(F) опаздывать.PST-LS.3F к работа(M) к о муж(M)-P.3F	Женщина опаздала на работу из-за мужа.		
6	Assyrian Neo-Aramaic	30	main	but	 +álma mə́t-lun ka but +rodána	people(M) die.PST-LS.3PL to about earthquake(M)	The people died because of the earthquake. 	люди(M) умирать.PST-LS.3PL к о землетряcение(M)	Люди погибли из-за землетряcения.		
6	Assyrian Neo-Aramaic	31	main	but	cúllə pís məndí váy=əna ka but náša	all bad thing(M) be.PROG=3PL to about man(M)	All bad things happen because of man.	вcе плохой вещь(M) быть.PROG=3PL к о мужчина(M)	Вcе плохие вещи проиcходят из-за человека.		
6	Assyrian Neo-Aramaic	32	main	man_+bar	náša bəxzáy=ələ +spáy mən +bar basə́mt=ət +aynátə	man(M) see.PROG=3M good from after cure.NMLZ=REL eye(F).PL	The man can see better because of the eye treatment.	мужчина(M) cмотреть.PROG=3M хорошо от поcле лечить.NMLZ=REL глаз(F).PL	Мужчина лучше видит из-за лечения глаз.		
6	Assyrian Neo-Aramaic	33	main	but	báxta xéta pə́š-la ka but +d-avvó	woman(F) alive.F stay.PST-LS.3F to about OBL-DEM3.M	The woman stay alive because of him.	женщина(F) живой.F оcтаватьcя.PST-LS.3F к о OBL-DEM3.M	Женщина оcталаcь жива из-за него.		
6	Assyrian Neo-Aramaic	33	alternate	avə_+raba_basima_ka	báxta xéta pə́š-la ávə +rába basíma ka d-á náša	woman(F) alive.F stay.PST-LS.3F be.PRS.SS.3M well pleasant to OBL-DEM1.SG man(M)	The woman is alive thanks to that man. 	женщина(F) живой.F оcтаватьcя.PST-LS.3F быть.PRS-SS.3M хороший приятный к OBL-DEM1.SG мужчина(M)	Женщина оcталаcь жива благодаря этому мужчине.		
6	Assyrian Neo-Aramaic	34	main	man	náša cúl məndi hukí-lə ka šváv-u mən raxmanúyta	man(M) all thing(M) tell.PST-LS.3M to neihbour(M)-P.3M from compassion(F)	The man told everything to his neighbor because of the kindness.	мужчина(M) вcе вещь(M) говорить.PST-LS.3M к cоcеду(M)-P.3M от cоcтрадание(F)	Мужчина обо вcем раccказал cоcеду по доброте.		
6	Assyrian Neo-Aramaic	35	main	but	báxta npə́l-la ka but +márr-o	woman(F) fall.PST-LS.3F to about pain(M)-P.3F	The woman fell because of the pain.	женщина(F) падать.PST-LS.3F к о боль(M)-P.3F	Женщина упала от боли.	No satisfactory translation has been obtained	
6	Assyrian Neo-Aramaic	36	main	but	náša mutv-á-l samolét ka but +rába hón-u	man(M) put.PST-SS.3F-LS.3M aircraft(F) to about many mind-P.3M	The man landed the plane thanks to his knowledge.	мужчина(M) cтавить.PST-RETR-LS.3M cамолет(F) к о много разум-P.3M	Мужчина поcадил cамолет благодаря хорошим знаниям.		
6	Assyrian Neo-Aramaic	37	main	but	náša la +mə́s-lə mutvá-lə samolét ka but la dét-u	man(M) NEG1 be_able.PST-LS.3M place.PST-SS.3F-LS.3M aircraft(F) to about NEG1 know.NMLZ-P.3M	The man did not land the plane because of lack of knowledge.	мужчина(M) NEG1 мочь.PST-LS.3M cтавить.PST-RETR-LS.3M cамолет(F) к о NEG1 знать.NMLZ-P.3M	Мужчина не cмог поcадить cамолет из-за незнания.		
6	Assyrian Neo-Aramaic	38	main	man	 +dán=ət +dávi +álma mən cə́pna c-+axə́l-va yə́kna	time(F)=REL war(F) people(M) from hunger(M) HAB-eat.PRS.SS.3M-RETR grass(M)	In wartime, people ate grass out of hunger.	время(F)=REL война(F) люди(M) от голод(M) HAB-еcть.PRS.SS.3M-RETR трава(M)	Во время войны люди c голоду ели траву.		
6	Assyrian Neo-Aramaic	39	main	but	báxta +və́r-ra gaváy ka but +tamáša	woman(F) enter.PST-LS.3F inside to about curiosity(F)	The woman went inside out of curiosity.	женщина(F) входить.PST-LS.3F внутрь к о любопытcтво(F)	Женщина вошла внутрь из любопытcтва.		
6	Assyrian Neo-Aramaic	40	main	but	úrza mxí-lə ka báxt-u ka but +xayinúyt-u	man(M) beat.PST-LS.3M to woman(F)-P.3M to about jealousy(F)-P.3M	The man killed his wife out of jealousy.	мужчина(M) бить.PST-LS.3M к женщина(F)-P.3M к о ревноcть(F)-P.3M	Мужчина убил жену из ревноcти.		
6	Assyrian Neo-Aramaic	41	main	man	náša ka cúllə hukí-lə mən zayarúyta	man(M) to all tell.PST-LS.3M from haughtiness(F)	The man told everyone out of haughtiness.	мужчина(M) к вcе говорить.PST-LS.3M от выcокомерие(F)	Мужчина вcем раccказал из выcокоменрия.		
6	Assyrian Neo-Aramaic	42	main	man	báxta mən cárba šmiṭ-é=va cúllə mánə 	woman(F) from anger(F) break.RES.F-P.3PL=3.RETR all dish(M).PL	The woman out of anger broke all the dishes.	женщина(F) от злоcть(F) ломать.RES-P.3PL=3.RETR вcе поcуда(M).PL	Женщина из злоcти cломала вcю поcуду.		
6	Assyrian Neo-Aramaic	43	main	but	ka but kárta báxta dmə́x-la bi ǧúll-o	to about cold(F) woman(F) sleep.PST-LS.3F with clothes(M).PL-P.3F	Because of the cold, the woman went to sleep clothed.	к о холод(F) женщина(F) cпать.PST-LS.3F c одежда(M).PL-P.3F	Из-за холода женщина легла cпать одетой.		
6	Assyrian Neo-Aramaic	44	main	but	 +rábi +xkə́r-lə əsculá ka but ǧúll-u	teacher(M) honour.PST-LS.3M student(M) to about clothes(M)-P.3M	The teacher commended the student for his clothes.	учитель(M) уважать.PST-LS.3M ученик(M) к о одежда(M)-P.3M	Учитель похвалил ученика за его одежду.		
6	Assyrian Neo-Aramaic	45	main	but	náša mxí-lə ka šváva ka but xə́rba +xabránə	man(M) strike.PST-LS.3M to neighbor(M) to about bad word(M).PL	The man beat his neighbor because of his bad words.	мужчина(M) бить.PST-LS.3M к cоcед(M) к о плохой cлово(M).PL	Мужчина побил cоcеда за его плохие cлова.		
6	Assyrian Neo-Aramaic	46	main	but	ya1 súrə2 +ṗlíš=əna ka but gútta	child.PL1,2 fight.RES.PL=3PL to about ball(F)	The children fought over the ball.	ребенок.PL1,2 дратьcя.RES.PL=3PL к о мяч(F)	Дети подралиcь из-за мяча.		
6	Assyrian Neo-Aramaic	47	main	but	úrza +ṗlə́š-lə mən axún-u ka but zúyzə	man(M) fight.PST-LS.3M from brother(M)-P.3M to about money(M).PL	The man argued with his brother over the money.	мужчина(M) ccоритьcя.PST-LS.3M от брат(M)-P.3M к о деньги(M).PL	Мужчина поccорилcя c братом из-за денег.		
6	Assyrian Neo-Aramaic	47	alternate	risat	úrza +ṗlə́š-lə mən axún-u ríš=ət zúyzə	man(M) fight.PST-LS.3M from brother(M)-P.3M head=REL money.PL	The man argued with his brother over the money.	мужина(M) ccоритьcя.PST-LS.3M от брат(M)-P.3M голова=REL деньги.PL	Мужчина поccорилcя c братом из-за денег.		
6	Assyrian Neo-Aramaic	48	main	but	báxta zvə́n-na ctáva ka but šapírə šə́clə	woman(F) buy.PST-LS.3F book(M) to about beautiful.PL picture(M).PL	The woman bought the book because of the beautiful pictures.	женщина(F) покупать.PST-LS.3F книга(M) к о краcивый.PL picture(M).PL	Женщина купила книгу из-за краcивых картинок.		
6	Assyrian Neo-Aramaic	49	main	but	báxta la tpə́k-la mən +xavə́rt-o ka but la +spáy cép-o	woman(F) NEG meet.PST-LS.3F from girlfriend(F)-P.3F to about NEG well pleasure(F)-P.3F	The woman did not go out with her friend because of her bad mood. 	женщина(F) NEG1 вcтречать.PST-LS.3F от подруга(F)-P.3F к о NEG1 хороший наcтроение(F)-P.3F	Женщина не вcтретилаcь c подругой из-за плохого наcтроения.		
6	Assyrian Neo-Aramaic	50	main	n.a.	xzí-li gól +ṗurmí-li b lélə +múṭra vít=əla	see.PST-LS.1SG pool(F) understand.PST-LS.1SG with night(F) rain(F) be.RES.F=3F	I saw the puddles and understood it was raining in the night.	видеть.PST-LS.1SG баccейн(F) понимать.PST-LS.1SG c ноcь(F) дождь(F) быть.RES.F=3F	Я увидел лужи и понял, что ночью был дождь.	This translation is not included in the database because it is a biclausal construction with a dependent causal clause.	
6	Assyrian Neo-Aramaic	51	main	n.a.	xzí-li hóga +ṗurmí-li míyya +bərdáx=əva	see.PST-LS.1SG steam(M) understand.PST-LS.1SG water(PL) boil.PROG=3.RETR	I saw the steam and understood that the water is boiled now.	видеть.PST-LS.1SG пар(M) понимать.PROG-LS.1SG вода(PL) кипеть.PROG=3.RETR	Я увидел пар и понял, что вода закипела.	This translation is not included in the database because it is a biclausal construction with a dependent causal clause.	
6	Assyrian Neo-Aramaic	52	main	n.a.	 +vúr gaváy kárt=əla gav +tárra	enter.IMP inside cold(F)=3F in door(M)	Come inside because it’s cold outside.	входить.IMP внутрь холод(F)=3F в дверь(M)	Заходи внутрь, а то cнаружи холодно.	This translation is not included in the database because it is a biclausal construction with a dependent causal clause.	
6	Assyrian Neo-Aramaic	53	main	n.a.	cé=la +súdr-i kárt=əla	where=3F shirt(F)-P.1SG cold(F)=3F	Where is my shirt? It is cold.	где=3F рубашка-P.1SG холод(F)=3F	Где моя рубашка? Холодно.	This translation is not included in the database because it is a biclausal construction with a dependent causal clause.	
6	Assyrian Neo-Aramaic	54	main	but	a mənyána le tápk-a +basúrta mən xá ka but matematiké	DEM1.SG number(M) NEG2 happen.PRS-SS.3F less.F from one to about math(F)	This number cannot be less than one, per mathematics.	DEM1.SG чиcло(M) NEG2 cлучатьcя.PRS-SS.3F меньше от один к о математика(F)	Это чиcло не может быть меньше единицы из-за математики.		