language_no	language_name	stimulus_no	status	causal_marker	sentence	glosses_en	back_translation_en	glosses_ru	back_translation_ru	comments	comments_informal
20	Latvian	48	main	GEN_del	Sieviet-e nopirk-a š-o grāmat-u t-ās zīmējum-u dēļ.	woman-NOM.SG buy.PST-3 this-ACC.SG book-ACC.SG this-GEN.SG.F picture-GEN.PL because.of	The woman bought the book because of the pictures.	женщина-NOM.SG купить.PST-3 этот-ACC.SG книга-ACC.SG тот-GEN.SG.F рисунок-GEN.PL из-за	‘Женщина купила эту книгу из-за этих рисунков.’		
20	Latvian	49	main	GEN_del	Sieviet-e ne-gāj-a uz tikšan-o-s ar draudzen-i slikt-ā noskaņojum-a dēļ.	woman-NOM.SG NEG-go.PST-3 to meeting-ACC.SG-RFL with friend-ACC.SG bad-GEN.SG.M.DEF mood-GEN.SG because.of	The woman did not go to the meeting with her friend because of her bad mood.	женщина-NOM.SG NEG-пойти.PST-3 на встреча-ACC.SG-RFL с подруга-ACC.SG плохой-GEN.SG.M.DEF настроение-GEN.SG из-за	‘Женщина не стала встречаться с подругой из-за плохого настроения.’		
20	Latvian	49	alternate	n.a.	Sieviet-e ne-gāj-a uz tikšan-o-s ar draudzen-i jo bij-a slikt-ā noskaņojum-ā.	woman-NOM.SG NEG-go.PST-3 to meeting-ACC.SG-RFL with friend-ACC.SG because be.PST-3 bad-LOC.SG mood-LOC.SG	The woman did not go to the meeting with her friend because she was in a bad mood.	женщина-NOM.SG NEG-пойти.PST-3 на встреча-ACC.SG-RFL с подруга-ACC.SG потому.что быть.PST-3 плохой-LOC.SG настроение-LOC.SG	‘Женщина не стала встречаться с подругой, потому что была в плохом настроении.’	This translation is not included in the database because the causing event is expressed as a dependent clause, not a noun phrase.	
20	Latvian	50	main	spriezot_pec_GEN	Spriež-ot pēc peļķ-ēm, nakt-ī bij-is liet-us.	judge-CNV after puddle-DAT.PL night-LOC.SG be-PST.ACT.PTCP.NOM.SG.M rain-NOM.SG	Judging by the puddles, it rained last night.	судить-CNV после лужа-DAT.PL ночь-LOC.SG быть-PST.ACT.PTCP.NOM.SG.M дождь-NOM.SG	‘Судя по лужам, ночью шел дождь.’		
20	Latvian	51	main	spriezot_pec_GEN	Spriež-ot pēc burbulīš-iem, ūden-s jau vār-ā-s.	judge-CNV after bubble-DAT.PL water-NOM.SG already boil-3-RFL	Judging by the bubbles, the water is boiling.	судить-CNV после пузырек-DAT.PL вода-NOM.SG уже кипеть-3-RFL	‘Судя по пузырькам, вода уже закипела.’		
20	Latvian	52	main	n.a.	Nāc iekšā -- auksti taču!	come.IMPER.2SG inside cold however	Come inside, because it is cold.	приходить.IMPER.2SG внутри холодно ведь	‘Заходи в дом, а то холодно.’	This translation is not included in the database because the causing event is expressed as a dependent clause, not a noun phrase.	
20	Latvian	53	main	n.a.	Kur ir man-s svīter-is pret aukstum-u?	where be.PRS.3 my-NOM.SG.M sweater-NOM.SG against cold-ACC.SG	Where is my sweater against cold?	где быть.PRS.3 мой-NOM.SG.M свитер-NOM.SG против холод-ACC.SG	‘Где мой свитер против холода?’	This translation is not included in the database because the caused event is not explicitly expressed.	
20	Latvian	54	main	GEN_del	Š-is skaitl-is ne-var bū-t mazāk-s par vien-u vienīb-u matemātik-as likum-u dēļ.	this-NOM.SG.M number-NOM.SG NEG-can.PRS.3 be-INF less-NOM.SG.M behind one-ACC.SG unit-ACC.SG mathematics-GEN.SG law-GEN.PL because.of	Per mathematical law, this number cannot be less than one.	этот-NOM.SG.M число-NOM.SG NEG-мочь.PRS.3 быть-INF меньше-NOM.SG.M за один единица математика-GEN.SG закон-GEN.PL из-за	‘Это число не может быть меньше единицы в силу математических законов.’		